[
  {"id": "C-res-huang", "claim": "외부 피드백 없는 자기 수정은 추론 성능을 개선하지 못했고 때로는 악화시켰다(Huang 외, 2023).", "grade": "문서",
   "evidence": [{"kind": "url", "ref": "https://arxiv.org/abs/2310.01798v2"}], "scope": "논문의 실험 조건"},
  {"id": "C-res-tyen", "claim": "추론 과정의 첫 오류 위치를 찾는 정확도는 가장 좋은 모델(GPT-4)도 52.87%였고, 오류 위치를 알려 주면 스스로 고쳐 전체 성능이 올랐다(Tyen 외, 2023).", "grade": "문서",
   "evidence": [{"kind": "url", "ref": "https://arxiv.org/html/2311.08516v3"}], "scope": "논문의 BIG-Bench Mistake 실험"},
  {"id": "C-res-panickssery", "claim": "LLM 평가자는 자기 출력을 알아보고 더 높게 평가했고, 알아보는 능력과 편애의 강도가 선형으로 함께 움직였다(Panickssery 외, NeurIPS 2024).", "grade": "문서",
   "evidence": [{"kind": "url", "ref": "https://papers.nips.cc/paper_files/paper/2024/hash/7f1f0218e45f5414c79c0679633e47bc-Abstract-Conference.html"}], "scope": "논문의 요약 과제 실험"},
  {"id": "C-res-kim-helm", "claim": "HELM 리더보드(모델 71개, 4지선다)에서 두 모델이 모두 틀린 문제의 평균 60%에서 같은 오답을 골랐다. 무작위라면 33%다(Kim 외, ICML 2025).", "grade": "문서",
   "evidence": [{"kind": "url", "ref": "https://arxiv.org/abs/2506.07962v1"}], "scope": "HELM MMLU 결과"},
  {"id": "C-res-kim-all", "claim": "350개가 넘는 모델 전체에서, 크고 정확한 모델일수록 제공사와 구조가 달라도 오류가 강하게 상관됐다(Kim 외, ICML 2025).", "grade": "문서",
   "evidence": [{"kind": "url", "ref": "https://arxiv.org/abs/2506.07962v1"}], "scope": "HELM과 HuggingFace 리더보드"},
  {"id": "C-res-sharma", "claim": "사용자 견해와 맞는 응답이 사람 평가에서 선호되며, 이 선호가 RLHF 모델에서 흔한 아첨의 원인 중 하나일 가능성이 높다(Sharma 외, 2023).", "grade": "문서",
   "evidence": [{"kind": "url", "ref": "https://www.anthropic.com/research/towards-understanding-sycophancy-in-language-models"}], "scope": "논문의 실험 조건"},
  {"id": "C-res-swe", "claim": "테스트를 통과한 AI 패치의 7.8%가 수정 파일만이 아닌 전체 개발자 테스트에서 실패했고, 표본 수동 검사로 추정한 오답 비율은 약 11%였다(ICSE 2026).", "grade": "문서",
   "evidence": [{"kind": "url", "ref": "https://arxiv.org/html/2503.15223v2"}, {"kind": "url", "ref": "https://openai.com/index/introducing-swe-bench-verified/"}], "scope": "SWE-bench Verified, 도구 3종 평균"},
  {"id": "C-res-mutgen", "claim": "LLM이 만든 테스트가 줄·분기 커버리지 100%인데 변이 점수는 4%인 사례가 있다(MutGen, 2025).", "grade": "문서",
   "evidence": [{"kind": "url", "ref": "https://arxiv.org/html/2506.02954v6"}], "scope": "HumanEval-Java 사례 1건"},

  {"id": "C-rounds-r1", "claim": "1라운드 적대적 검증(새 서브에이전트, 코드와 공격 범위만 받음)이 Rust 작업 하네스에서 높음 4, 중간 10, 낮음 14를 찾았다.", "grade": "기록됨",
   "evidence": [{"kind": "file", "ref": "reports/2026-10-30-verification-rounds.md"}], "scope": "2026-10-28~29, 하네스 1차 완성본"},
  {"id": "C-rounds-r2", "claim": "2라운드 회귀 재검증(1라운드와 같은 서브에이전트)에서 높음·중간 중 FIXED 9, PARTIAL 4였고, 새 문제는 중간 2와 낮음 2, 공허한 테스트는 3개였다.", "grade": "기록됨",
   "evidence": [{"kind": "file", "ref": "reports/2026-10-30-verification-rounds.md"}], "scope": "2026-10-29, 1라운드 수정본"},
  {"id": "C-rounds-r3", "claim": "3라운드 적대적 검증(앞 라운드 발견 목록을 받지 않은 새 서브에이전트)이 높음 0, 중간 3, 낮음 5, 문서 6을 찾았다.", "grade": "기록됨",
   "evidence": [{"kind": "file", "ref": "reports/2026-10-30-verification-rounds.md"}], "scope": "2026-10-29, 2라운드 수정본"},
  {"id": "C-rounds-fc", "claim": "가이드의 팩트체크(새 서브에이전트)가 높음 3, 중간 7을 찾았다.", "grade": "기록됨",
   "evidence": [{"kind": "file", "ref": "reports/2026-10-30-verification-rounds.md"}], "scope": "2026-10-28, Rust × AI 활용 지도 초판"},
  {"id": "C-rounds-r4", "claim": "플레이북과 핫스팟 결과물의 적대적 검증이 높음 0, 중간 6을 찾았고, 같은 검증자의 재검증에서 중간 6건이 모두 FIXED, 새 높음·중간 0이었다.", "grade": "기록됨",
   "evidence": [{"kind": "file", "ref": "reports/2026-10-30-verification-rounds.md"}], "scope": "2026-10-30"},
  {"id": "C-rounds-cost", "claim": "검증 서브에이전트 한 번마다 작업 완료 알림에 표시된 토큰은 약 20만~26만, 실행 시간은 53분에서 약 3시간이었다.", "grade": "확인",
   "evidence": [{"kind": "file", "ref": "reports/2026-10-30-verification-rounds.md"}], "scope": "1~3라운드와 팩트체크 4회, 작업 완료 알림 기준. 토큰이 누적값인지는 미확인"},
  {"id": "C-rounds-vacuous", "claim": "수정마다 만든 회귀 테스트 중 4개가, 보호하려던 코드를 지워도 통과했다(2라운드 3개, 3라운드 1개).", "grade": "기록됨",
   "evidence": [{"kind": "file", "ref": "reports/2026-10-30-verification-rounds.md"}], "scope": "Rust 작업 하네스의 훅 회귀 테스트"},
  {"id": "C-rounds-trend", "claim": "새로 찾은 높음은 4 → 0 → 0, 중간은 10 → 2 → 3이었고, 2라운드에는 부분 수정 4건(높음 1, 중간 3)이 남아 있었다.", "grade": "기록됨",
   "evidence": [{"kind": "file", "ref": "reports/2026-10-30-verification-rounds.md"}], "scope": "1~3라운드"},
  {"id": "C-rounds-timebox", "claim": "3라운드에 한 시간 안쪽을 요청했으나 176.6분이 걸렸다.", "grade": "확인",
   "evidence": [{"kind": "file", "ref": "reports/2026-10-30-verification-rounds.md"}], "scope": "작업 완료 알림 기준"},
  {"id": "C-harness-hooktests", "claim": "Rust 작업 하네스의 훅 회귀 테스트는 수정 라운드를 거치며 18개 → 27개 → 30개로 늘었고, 마지막 판에서 30개가 모두 통과했다.", "grade": "확인",
   "evidence": [{"kind": "cmd", "ref": "scripts/test-hooks.sh (rust-ai-harness, 임시 저장소 루트로 복사한 사본)"}], "scope": "2026-10-30, 2 vCPU 샌드박스"},
  {"id": "C-harness-gate", "claim": "Rust 작업 하네스의 전체 게이트(정책, fmt, clippy -D warnings, 테스트 15개와 doctest 2개, Python 브리지, rustdoc, cargo-deny)가 통과했다.", "grade": "확인",
   "evidence": [{"kind": "cmd", "ref": "scripts/verify.sh full (rust-ai-harness)"}], "scope": "2026-10-30, rustc 1.99.1, 2 vCPU 샌드박스"},

  {"id": "C-wa-hooks", "claim": "work-atlas 훅 지연 패치로 편집 훅이 LANG 190→101ms, ZK 192→110ms, 이슈 프롬프트 훅이 LANG 340→197ms, ZK 636→393ms가 됐다(원본과 패치를 번갈아 21회씩 돌린 중앙값).", "grade": "확인",
   "evidence": [{"kind": "cmd", "ref": "reports/2026-10-30-hotspots/work-atlas/bench-hooks.sh <원본> <패치> inst/zk <zookeeper> <Leader.java> ZOOKEEPER-4990"}, {"kind": "file", "ref": "reports/2026-10-30-hotspots.md"}],
   "scope": "x86_64 2 vCPU 샌드박스, Python 3.13.18, orjson 3.13, 2026-10-30"},
  {"id": "C-wa-range", "claim": "같은 훅 비교를 여러 번 재면 편집 훅 단축 비율이 -32%에서 -50% 사이에서 흔들렸다.", "grade": "확인",
   "evidence": [{"kind": "file", "ref": "reports/2026-10-30-hotspots.md"}], "scope": "출발점 세션의 측정 3회(몰아서 1회, 번갈아 21회, diffcheck 11회), 2026-10-30~31"},
  {"id": "C-wa-build", "claim": "같은 기준 시각으로 지은 ZK 전체 빌드가 18.2~18.8초에서 14.1~14.4초로 줄었고, 모델 파일 5개가 바이트 단위로 같았다.", "grade": "확인",
   "evidence": [{"kind": "file", "ref": "reports/2026-10-30-hotspots.md"}], "scope": "atlas build --as-of 2026-10-29T00:00:00+00:00 --no-llm, 번갈아 3회, 2026-10-30"},
  {"id": "C-wa-tests", "claim": "패치한 work-atlas가 테스트 277개를 통과했다(1개 skip). orjson이 있을 때와 없을 때 모두 같다.", "grade": "확인",
   "evidence": [{"kind": "cmd", "ref": "python -m unittest discover -s tests (work-atlas, 패치 적용)"}, {"kind": "url", "ref": "https://github.com/d-j-lee/work-atlas/pull/1"}], "scope": "Python 3.13.18 로컬, PR CI는 Linux 3.11·3.13과 Windows 3.13"},
  {"id": "C-dc-demo", "claim": "diffcheck로 ZK 훅을 다시 비교하면 출력은 같고(306바이트, 2,024바이트, 결정성 통과), 두 번 잰 단축 비율은 편집 훅 -42~-46%, 프롬프트 훅 -38~-39%였다.", "grade": "확인",
   "evidence": [{"kind": "cmd", "ref": "python3 -I scripts/diffcheck.py --base <원본 훅> --cand <패치 훅> --stdin edit.json --determinism --timing 11"}], "scope": "번갈아 11회 중앙값을 2회 실행, 2026-10-31, 2 vCPU 샌드박스"},
  {"id": "C-trap-empty", "claim": "같은 세션 ID로 work-atlas 편집 훅을 두 번 실행하면 출력이 306바이트에서 0바이트가 된다. 이때 diffcheck는 두 번 모두 empty로 실패한다.", "grade": "확인",
   "evidence": [{"kind": "file", "ref": "reports/2026-10-30-hotspots.md"}], "scope": "2026-10-30~31"},
  {"id": "C-trap-asof", "claim": "work-atlas를 기준 시각 없이 두 번 빌드하면 categories.json이 as_of와 age_h_p50에서 달라진다.", "grade": "확인",
   "evidence": [{"kind": "file", "ref": "reports/2026-10-30-hotspots.md"}], "scope": "ZK 인스턴스, 2026-10-30"},
  {"id": "C-sim-same", "claim": "Rust 질의 프로토타입이 실제 질의 4종, 합성 다국어 질의 13종, 반올림 경계 값 13,048개 색인에서 Python과 같은 상위 200개를 냈다.", "grade": "확인",
   "evidence": [{"kind": "cmd", "ref": "reports/2026-10-30-hotspots/atlas-sim/bench-sim.sh <text_index.json> <exclude> <query> 11"}], "scope": "serde_json float_roundtrip, Python round(x, 4)와 같은 반올림, 2026-10-30"},
  {"id": "C-sim-ulp", "claim": "Rust 이식의 실수 파싱이 1 ULP 어긋나 반올림 경계 값 13,048개 중 1,159개에서 Python과 달랐고, 고친 뒤 0개가 됐다.", "grade": "확인",
   "evidence": [{"kind": "file", "ref": "reports/2026-10-30-hotspots.md"}], "scope": "검증자가 만든 경계 색인, 2026-10-30"},
  {"id": "C-sim-proc", "claim": "질의 1회를 프로세스 단위로 재면 Python(orjson) 대비 Rust가 LANG 약 220→55ms, ZK 약 330→135ms였다.", "grade": "확인",
   "evidence": [{"kind": "cmd", "ref": "reports/2026-10-30-hotspots/atlas-sim/bench-sim.sh <text_index.json> <exclude> <query> 11"}], "scope": "번갈아 11회 중앙값, 질의 2종, 2026-10-30"},
  {"id": "C-sim-inproc", "claim": "같은 프로세스 안의 색인 읽기와 질의만 비교하면 ZK 약 130→105ms라서, 프로세스 단위 차이의 대부분(150ms 안팎)은 Python 기동과 import다.", "grade": "도출",
   "evidence": [{"kind": "cmd", "ref": "reports/2026-10-30-hotspots/atlas-sim/bench-sim.sh <text_index.json> <exclude> <query> 11"}], "scope": "C-sim-proc와 같은 실행의 단계별 시간에서 계산"},
  {"id": "C-db-js", "claim": "docbench의 jsdiff 비교가 4,334줄 문서에서 가벼운 수정 19ms, 40% 재작성 3.6초, 재배치·재작성 4.0초였고, 이 계산은 화면 스레드에서 돈다.", "grade": "확인",
   "evidence": [{"kind": "cmd", "ref": "node reports/2026-10-30-hotspots/docbench-diff/bench.mjs 1000 2000 4334"}], "scope": "diff@9.0.0, Node 22.23.4, 2026-10-30"},
  {"id": "C-db-wasm", "claim": "같은 의미로 옮긴 Rust → WASM은 JSON 왕복을 포함해 40% 재작성 0.72초, 재배치·재작성 0.50초였고, 가벼운 수정에서는 19→33ms로 오히려 느렸다. wasm 파일은 최적화 전 561KB다.", "grade": "확인",
   "evidence": [{"kind": "cmd", "ref": "node reports/2026-10-30-hotspots/docbench-diff/bench-wasm.mjs <docdiff.wasm> 1000 2000 4334"}], "scope": "V8(Node 22.23.4), 2026-10-30"},
  {"id": "C-db-highlight", "claim": "WASM 이식은 더한·지운 줄 수가 9개 경우 모두, 줄 목록이 6개 경우에서 jsdiff와 같았고, 낱말 강조까지 같은 것은 가벼운 수정 3개뿐이었다.", "grade": "확인",
   "evidence": [{"kind": "file", "ref": "reports/2026-10-30-hotspots.md"}], "scope": "실제 문서 4,334줄로 만든 9개 경우, 2026-10-30"},
  {"id": "C-db-fuzz", "claim": "무작위 입력 4,000쌍에서 WASM 이식과 jsdiff는 줄 수 100%, 줄 목록 99%, 낱말 분할 86%가 같았다.", "grade": "확인",
   "evidence": [{"kind": "file", "ref": "reports/2026-10-30-hotspots.md"}], "scope": "CRLF·이모지·결합 문자·빈 문자열 포함 생성기, 2026-10-30"},
  {"id": "C-db-caps", "claim": "jsdiff의 timeout(200)·maxEditLength(1000) 옵션은 각각 약 200ms·100ms 만에 포기하고 undefined를 돌려준다.", "grade": "확인",
   "evidence": [{"kind": "cmd", "ref": "node reports/2026-10-30-hotspots/docbench-diff/caps.mjs"}], "scope": "diff@9.0.0, 2026-10-30"},
  {"id": "C-tool-ruff", "claim": "ruff 0.17.3이 work-atlas 16,738줄을 37~42ms에 검사했고 버그 계열 18건을 냈다. 확인된 버그는 없었다.", "grade": "확인",